# [LeetCode](https://www.leetcode.com/)

| Sr. | Date     | Problem                                                                                                                                                                                                                                 | Difficulty | Solution                       | Month    |
| --- | -------- | --------------------------------------------------------------------------------------------------------------------------------------------------------------------------------------------------------------------------------------- | ---------- | ------------------------------ | -------- |
| 1   | 05/01/26 | [Maximum Matrix Sum](https://leetcode.com/problems/maximum-matrix-sum/description/?envType=daily-question&envId=2026-01-05)                                                                                                             | Medium     | [Java](./January/LC1975.java)  | January  |
| 2   | 06/01/26 | [Maximum Level Sum of a Binary Tree](https://leetcode.com/problems/maximum-level-sum-of-a-binary-tree/description/?envType=daily-question&envId=2026-01-06)                                                                             | Medium     | [Java](./January/LC1161.java)  | January  |
| 3   | 07/01/26 | [Maximum Product of Splitted Binary Tree](https://leetcode.com/problems/maximum-product-of-splitted-binary-tree/description/?envType=daily-question&envId=2026-01-07)                                                                   | Medium     | [Java](./January/LC1339.java)  | January  |
| 4   | 08/01/26 | [Max Dot Product of Two Subsequences](https://leetcode.com/problems/max-dot-product-of-two-subsequences/description/?envType=daily-question&envId=2026-01-08)                                                                           | Hard       | [Java](./January/LC1458.java)  | January  |
| 6   | 09/01/26 | [Smallest Subtree with all the Deepest Nodes](https://leetcode.com/problems/smallest-subtree-with-all-the-deepest-nodes/description/?envType=daily-question&envId=2026-01-09)                                                           | Medium     | [Java](./January/LC865.java)   | January  |
| 7   | 10/01/26 | [Minimum ASCII Delete Sum for Two Strings](https://leetcode.com/problems/minimum-ascii-delete-sum-for-two-strings/description/?envType=daily-question&envId=2026-01-10)                                                                 | Medium     | [Java](./January/LC712.java)   | January  |
| 8   | 11/01/26 | [Maximal Rectangle](https://leetcode.com/problems/maximal-rectangle/description/?envType=daily-question&envId=2026-01-11)                                                                                                               | Hard       | [Java](./January/LC85.java)    | January  |
| 9   | 12/01/26 | [Minimum Time Visiting All Points](https://leetcode.com/problems/minimum-time-visiting-all-points/description/?envType=daily-question&envId=2026-01-12)                                                                                 | Easy       | [Java](./January/LC1266.java)  | January  |
| 10  | 13/01/26 | [Separate Squares I](https://leetcode.com/problems/separate-squares-i/description/?envType=daily-question&envId=2026-01-13)                                                                                                             | Medium     | [Java](./January/LC3453.java)  | January  |
| 11  | 14/01/26 | [Separate Squares II](https://leetcode.com/problems/separate-squares-ii/description/?envType=daily-question&envId=2026-01-14)                                                                                                           | Hard       | [Java](./January/LC3454.java)  | January  |
| 12  | 15/01/26 | [Maximize Area of Square Hole in Grid](https://leetcode.com/problems/maximize-area-of-square-hole-in-grid/description/?envType=daily-question&envId=2026-01-15)                                                                         | Medium     | [Java](./January/LC2943.java)  | January  |
| 13  | 16/01/26 | [Maximum Square Area by Removing Fences From a Field](https://leetcode.com/problems/maximum-square-area-by-removing-fences-from-a-field/description/?envType=daily-question&envId=2026-01-16)                                           | Medium     | [Java](./January/LC2975.java)  | January  |
| 14  | 17/01/26 | [Find the Largest Area of Square Inside Two Rectangles](https://leetcode.com/problems/find-the-largest-area-of-square-inside-two-rectangles/submissions/1890065930/?envType=daily-question&envId=2026-01-17)                            | Medium     | [Java](./January/LC3047.java)  | January  |
| 15  | 18/01/26 | [Largest Magic Square](https://leetcode.com/problems/largest-magic-square/description/?envType=daily-question&envId=2026-01-18)                                                                                                         | Medium     | [Java](./January/LC1895.java)  | January  |
| 16  | 19/01/26 | [Maximum Side Length of a Square with Sum Less than or Equal to Threshold](https://leetcode.com/problems/maximum-side-length-of-a-square-with-sum-less-than-or-equal-to-threshold/description/?envType=daily-question&envId=2026-01-19) | Medium     | [Java](./January/LC1292.java)  | January  |
| 17  | 20/01/26 | [Construct the Minimum Bitwise Array I](https://leetcode.com/problems/construct-the-minimum-bitwise-array-i/description/?envType=daily-question&envId=2026-01-20)                                                                       | Easy       | [Java](./January/LC3314.java)  | January  |
| 18  | 21/01/26 | [Construct the Minimum Bitwise Array II](https://leetcode.com/problems/construct-the-minimum-bitwise-array-ii/description/?envType=daily-question&envId=2026-01-21)                                                                     | Medium     | [Java](./January/LC3315.java)  | January  |
| 19  | 22/01/26 | [Minimum Pair Removal to Sort Array I](https://leetcode.com/problems/minimum-pair-removal-to-sort-array-i/description/?envType=daily-question&envId=2026-01-22)                                                                         | Easy       | [Java](./January/LC3507.java)  | January  |
| 20  | 23/01/26 | [Minimum Pair Removal to Sort Array II](https://leetcode.com/problems/minimum-pair-removal-to-sort-array-ii/description/?envType=daily-question&envId=2026-01-23)                                                                       | Hard       | [Java](./January/LC3510.java)  | January  |
| 21  | 24/01/26 | [Minimize Maximum Pair Sum in Array](https://leetcode.com/problems/minimize-maximum-pair-sum-in-array/description/?envType=daily-question&envId=2026-01-24)                                                                             | Medium     | [Java](./January/LC1877.java)  | January  |
| 22  | 25/01/26 | [Minimum Difference Between Highest and Lowest of K Score](https://leetcode.com/problems/minimum-difference-between-highest-and-lowest-of-k-scores/description/?envType=daily-question&envId=2026-01-25)                                | Easy       | [Java](./January/LC1984.java)  | January  |
| 23  | 26/01/26 | [Minimum Absolute Differences](https://leetcode.com/problems/minimum-absolute-difference/description/?envType=daily-question&envId=2026-01-26)                                                                                          | Easy       | [Java](./January/LC1200.java)  | January  |
| 24  | 27/01/26 | [Minimum Cost Path with Edge Reversals](https://leetcode.com/problems/minimum-cost-path-with-edge-reversals/description/?envType=daily-question&envId=2026-01-27)                                                                       | Medium     | [Java](./January/LC3650.java)  | January  |
| 25  | 28/01/26 | [Minimum Cost Path with Teleportations](https://leetcode.com/problems/minimum-cost-path-with-teleportations/submissions/1899966374/?envType=daily-question&envId=2026-01-28)                                                            | Hard       | [Java](./January/LC3651.java)  | January  |
| 26  | 29/01/26 | [Minimum Cost to Convert String I](https://leetcode.com/problems/minimum-cost-to-convert-string-i/description/?envType=daily-question&envId=2026-01-29)                                                                                 | Medium     | [Java](./January/LC2976.java)  | January  |
| 30  | 02/02/26 | [Divide an Array Into Subarrays With Minimum Cost II](https://leetcode.com/problems/divide-an-array-into-subarrays-with-minimum-cost-ii/description/?envType=daily-question&envId=2026-02-02)                                           | Hard       | [Java](./February/LC3013.java) | February |
| 31  | 03/02/26 | [Trionic Array I](https://leetcode.com/problems/trionic-array-i/description/?envType=daily-question&envId=2026-02-03)                                                                                                                   | Easy       | [Java](./February/LC3637.java) | February |
| 32  | 04/02/26 | [Trionic Array II](https://leetcode.com/problems/trionic-array-ii/description/?envType=daily-question&envId=2026-02-04)                                                                                                                 | Hard       | [Java](./February/LC3640.java) | February |
| 33  | 05/02/26 | [Transformed Array](https://leetcode.com/problems/transformed-array/description/?envType=daily-question&envId=2026-02-05)                                                                                                               | Easy       | [Java](./February/LC3379.java) | February |
| 34  | 06/02/26 | [Minimum Removals to Balance Array](https://leetcode.com/problems/minimum-removals-to-balance-array/description/?envType=daily-question&envId=2026-02-06)                                                                               | Medium     | [Java](./February/LC3634.java) | February |
| 35  | 07/02/26 | [Minimum Deletions to Make String Balanced](https://leetcode.com/problems/minimum-deletions-to-make-string-balanced/description/?envType=daily-question&envId=2026-02-07)                                                               | Medium     | [Java](./February/LC1653.java) | February |
| 36  | 08/02/26 | [Balanced Binary Tree](https://leetcode.com/problems/balanced-binary-tree/description/?envType=daily-question&envId=2026-02-08)                                                                                                         | Easy       | [Java](./February/LC110.java)  | February |
| 37  | 09/02/26 | [Balance a Binary Search Tree](https://leetcode.com/problems/balance-a-binary-search-tree/description/?envType=daily-question&envId=2026-02-09)                                                                                         | Medium     | [Java](./February/LC1382.java) | February |
| 38  | 10/02/26 | [Longest Balanced Subarray I](https://leetcode.com/problems/longest-balanced-subarray-i/description/?envType=daily-question&envId=2026-02-10)                                                                                           | Medium     | [Java](./February/LC3719.java) | February |
| 39  | 11/02/26 | [Longest Balanced Subarray II](https://leetcode.com/problems/longest-balanced-subarray-ii/description/?envType=daily-question&envId=2026-02-11)                                                                                         | Hard       | [Java](./February/LC3721.java) | February |
| 40  | 12/02/26 | [Longest Balanced Substring I](https://leetcode.com/problems/longest-balanced-substring-i/description/?envType=daily-question&envId=2026-02-12)                                                                                         | Medium     | [Java](./February/LC3713.java) | February |
| 41  | 13/02/26 | [Longest Balanced Substring II](https://leetcode.com/problems/longest-balanced-substring-ii/description/?envType=daily-question&envId=2026-02-13)                                                                                       | Medium     | [Java](./February/LC3714.java) | February |
| 42  | 14/02/26 | [Champagne Tower](https://leetcode.com/problems/champagne-tower/description/?envType=daily-question&envId=2026-02-14)                                                                                                                   | Medium     | [Java](./February/LC799.java)  | February |
| 43  | 15/02/26 | [Add Binary](https://leetcode.com/problems/add-binary/description/?envType=daily-question&envId=2026-02-15)                                                                                                                             | Easy       | [Java](./February/LC67.java)   | February |
| 44  | 16/02/26 | [Reverse Bits](https://leetcode.com/problems/reverse-bits/description/?envType=daily-question&envId=2026-02-16)                                                                                                                         | Easy       | [Java](./February/LC190.java)  | February |
| 45  | 17/02/26 | [Binary Watch](https://leetcode.com/problems/binary-watch/description/?envType=daily-question&envId=2026-02-17)                                                                                                                         | Easy       | [Java](./February/LC401.java)  | February |
| 46  | 18/02/26 | [Binary Number with Alternating Bits](https://leetcode.com/problems/binary-number-with-alternating-bits/description/?envType=daily-question&envId=2026-02-18)                                                                           | Easy       | [Java](./February/LC693.java)  | February |
| 47  | 19/02/26 | [Count Binary Substrings](https://leetcode.com/problems/count-binary-substrings/description/?envType=daily-question&envId=2026-02-19)                                                                                                   | Easy       | [Java](./February/LC696.java)  | February |
| 48  | 20/02/26 | [Special Binary String](https://leetcode.com/problems/special-binary-string/description/?envType=daily-question&envId=2026-02-20)                                                                                                       | Hard       | [Java](./February/LC761.java)  | February |
| 49  | 21/02/26 | [Prime Number of Set Bits in Binary Representation](https://leetcode.com/problems/prime-number-of-set-bits-in-binary-representation/description/?envType=daily-question&envId=2026-02-21)                                               | Easy       | [Java](./February/LC762.java)  | February |
